{
  "result_id": "p1/at-1",
  "worker_class": "llm-research",
  "proof_id": "p1",
  "base_revision": 3,
  "lease_id": "lease-p1-7",
  "fencing_token": 2,
  "summary": "Proposes a bridge lemma after a missing-lemma obstruction.",
  "produced_claim_ids": ["p1/c-2"],
  "produced_obstruction_ids": [],
  "artifact_hashes": ["sha256:a1a1a1a1a1a1a1a1a1a1a1a1a1a1a1a1a1a1a1a1a1a1a1a1a1a1a1a1a1a1a1a1"],
  "evidence_kind": "critic-review"
}
